uc1:

CREATE DATABASE addressbook_service; 
USE addressbook_service; 
SELECT DATABASE(); 
+---------------------+
| DATABASE()          |
+---------------------+
| addressbook_service |
+---------------------+
1 row in set (0.0003 sec)

uc2: 

 CREATE TABLE addressbook(                                                                                           
 first_name  VARCHAR(50) NOT NULL,                                                                                    
 last_name   VARCHAR(50) NOT NULL,                                                                                     
 address     VARCHAR(50) NOT NULL,                                                                                       
 city        VARCHAR(50) NOT NULL,                                                                                          
 state       VARCHAR(50) NOT NULL,                                                                                         
 zip         INT unsigned NOT NULL,                                                                                            
 phone       INT NOT NULL,                                                                                         
 email       VARCHAR(50) NOT NULL                                                                                          
 );
 
DESCRIBE addressbook; 
+------------+--------------+------+-----+---------+-------+
| Field      | Type         | Null | Key | Default | Extra |
+------------+--------------+------+-----+---------+-------+
| first_name | varchar(50)  | NO   |     | NULL    |       |
| last_name  | varchar(50)  | NO   |     | NULL    |       |
| address    | varchar(50)  | NO   |     | NULL    |       |
| city       | varchar(50)  | NO   |     | NULL    |       |
| state      | varchar(50)  | NO   |     | NULL    |       |
| zip        | int unsigned | NO   |     | NULL    |       |
| phone      | int          | NO   |     | NULL    |       |
| email      | varchar(50)  | NO   |     | NULL    |       |
+------------+--------------+------+-----+---------+-------+
8 rows in set (0.0613 sec)

uc3: 

 INSERT INTO addressbook VALUES 
('aakash','gandhi','sector 14','panipat','haryana','123456','987654321','aakash@gmail.com'),
('nik','singh','alpha 2',' greater noida','up','741147','7858585858','nik@gmail.com'), 
('arpit','kaur','beta 1','greater noida','up','741147','9898363283','arpit@gmail.com'), 
('adi','pandat','emirates','jodhpur','rajasthan','654321','8787843527','adi@gmail.com');

SELECT * from addressbook;
+------------+-----------+-----------+---------------+-----------+--------+-----------+------------------+
| first_name | last_name | address   | city          | state     | zip    | phone     | email            |
+------------+-----------+-----------+---------------+-----------+--------+-----------+------------------+
| aakash     | gandhi    | sector 14 | panipat       | haryana   | 123456 | 987654321 | aakash@gmail.com |
| nik        | singh     | alpha 2   | greater noida | up        | 741147 |  76543210 | nik@gmail.com    |
| arpit      | kaur      | beta 1    | greater noida | up        | 741147 |   9893283 | arpit@gmail.com  |
| adi        | pandat    | emirates  | jodhpur       | rajasthan | 654321 |   8787843 | adi@gmail.com    |
+------------+-----------+-----------+---------------+-----------+--------+-----------+------------------+
4 rows in set (0.0194 sec)

uc4:

 UPDATE addressbook SET city = 'gurugram' WHERE first_name ='nik';
+------------+-----------+-----------+---------------+-----------+--------+-----------+------------------+
| first_name | last_name | address   | city          | state     | zip    | phone     | email            |
+------------+-----------+-----------+---------------+-----------+--------+-----------+------------------+
| aakash     | gandhi    | sector 14 | panipat       | haryana   | 123456 | 987654321 | aakash@gmail.com |
| nik        | singh     | alpha 2   | gurugram      | up        | 741147 |  76543210 | nik@gmail.com    |
| arpit      | kaur      | beta 1    | greater noida | up        | 741147 |   9893283 | arpit@gmail.com  |
| adi        | pandat    | emirates  | jodhpur       | rajasthan | 654321 |   8787843 | adi@gmail.com    |
+------------+-----------+-----------+---------------+-----------+--------+-----------+------------------+
4 rows in set (0.0761 sec)


uc5:

DELETE FROM addressbook WHERE first_name = 'adi'; 
+------------+-----------+-----------+---------------+---------+--------+-----------+------------------+
| first_name | last_name | address   | city          | state   | zip    | phone     | email            |
+------------+-----------+-----------+---------------+---------+--------+-----------+------------------+
| aakash     | gandhi    | sector 14 | panipat       | haryana | 123456 | 987654321 | aakash@gmail.com |
| nik        | singh     | alpha 2   | gurugram      | haryana | 741147 |  76543210 | nik@gmail.com    |
| arpit      | kaur      | beta 1    | greater noida | up      | 741147 |   9893283 | arpit@gmail.com  |
+------------+-----------+-----------+---------------+---------+--------+-----------+------------------+
3 rows in set (0.0346 sec)

uc6:


SELECT * FROM addressbook WHERE city = 'greater noida'; 
+------------+-----------+---------+---------------+-------+--------+---------+-----------------+
| first_name | last_name | address | city          | state | zip    | phone   | email           |
+------------+-----------+---------+---------------+-------+--------+---------+-----------------+
| arpit      | kaur      | beta 1  | greater noida | up    | 741147 | 9893283 | arpit@gmail.com |
+------------+-----------+---------+---------------+-------+--------+---------+-----------------+
1 row in set (0.0007 sec)


SELECT * FROM addressbook WHERE state = 'haryana'; 
+------------+-----------+-----------+----------+---------+--------+-----------+------------------+
| first_name | last_name | address   | city     | state   | zip    | phone     | email            |
+------------+-----------+-----------+----------+---------+--------+-----------+------------------+
| aakash     | gandhi    | sector 14 | panipat  | haryana | 123456 | 987654321 | aakash@gmail.com |
| nik        | singh     | alpha 2   | gurugram | haryana | 741147 |  76543210 | nik@gmail.com    |
+------------+-----------+-----------+----------+---------+--------+-----------+------------------+
2 rows in set (0.0005 sec)


uc7:

 SELECT city,COUNT(city) FROM addressbook GROUP BY city;
+---------------+-------------+
| city          | COUNT(city) |
+---------------+-------------+
| panipat       |           1 |
| gurugram      |           1 |
| greater noida |           1 |
+---------------+-------------+
3 rows in set (0.0010 sec)


SELECT state,COUNT(state) FROM addressbook GROUP BY state;
+---------+--------------+
| state   | COUNT(state) |
+---------+--------------+
| haryana |            2 |
| up      |            1 |
+---------+--------------+
2 rows in set (0.0012 sec)


uc8:

SELECT * FROM addressbook WHERE city = 'greater noida' ORDER BY first_name;
+------------+-----------+---------+---------------+-------+--------+---------+-----------------+
| first_name | last_name | address | city          | state | zip    | phone   | email           |
+------------+-----------+---------+---------------+-------+--------+---------+-----------------+
| arpit      | kaur      | beta 1  | greater noida | up    | 741147 | 9893283 | arpit@gmail.com |
+------------+-----------+---------+---------------+-------+--------+---------+-----------------+
1 row in set (0.0296 sec)


uc9:

ALTER TABLE addressbook ADD name VARCHAR(50); 
ALTER TABLE addressbook ADD type VARCHAR(50); 
DESCRIBE addressbook;
+------------+--------------+------+-----+---------+-------+
| Field      | Type         | Null | Key | Default | Extra |
+------------+--------------+------+-----+---------+-------+
| first_name | varchar(50)  | NO   |     | NULL    |       |
| last_name  | varchar(50)  | NO   |     | NULL    |       |
| address    | varchar(50)  | NO   |     | NULL    |       |
| city       | varchar(50)  | NO   |     | NULL    |       |
| state      | varchar(50)  | NO   |     | NULL    |       |
| zip        | int unsigned | NO   |     | NULL    |       |
| phone      | int          | NO   |     | NULL    |       |
| email      | varchar(50)  | NO   |     | NULL    |       |
| name       | varchar(50)  | YES  |     | NULL    |       |
| type       | varchar(50)  | YES  |     | NULL    |       |
+------------+--------------+------+-----+---------+-------+
10 rows in set (0.0984 sec)

INSERT INTO addressbook VALUES ('riya','gupta','sector 42','bangalore','karnataka','565656','89596847','riya@gmail.com',NULL,'Friend');
SELECT * from addressbook;
+------------+-----------+-----------+---------------+-----------+--------+-----------+------------------+------+------------+
| first_name | last_name | address   | city          | state     | zip    | phone     | email            | name | type       |
+------------+-----------+-----------+---------------+-----------+--------+-----------+------------------+------+------------+
| aakash     | gandhi    | sector 14 | panipat       | haryana   | 123456 | 987654321 | aakash@gmail.com | NULL | Family     |
| nik        | singh     | alpha 2   | gurugram      | haryana   | 741147 |  76543210 | nik@gmail.com    | NULL | Family     |
| arpit      | kaur      | beta 1    | greater noida | up        | 741147 |   9893283 | arpit@gmail.com  | NULL | Profession |
| riya       | gupta     | sector 42 | bangalore     | karnataka | 565656 |  89596847 | riya@gmail.com   | NULL | Friend     |
+------------+-----------+-----------+---------------+-----------+--------+-----------+------------------+------+------------+
4 rows in set (0.0007 sec)


uc10:

SELECT type, COUNT(type) FROM addressbook GROUP BY type;
+------------+-------------+
| type       | COUNT(type) |
+------------+-------------+
| Family     |           2 |
| Profession |           1 |
| Friend     |           1 |
+------------+-------------+
3 rows in set (0.0007 sec)


uc11 :

CREATE TABLE address_books(
addressbook_name   VARCHAR(200) NOT NULL,
type               VARCHAR(200) NOT NULL,
PRIMARY KEY        (addressbook_name)
);

INSERT INTO address_books VALUES
('book1','Family'),
('book2','Profession'),
('book3','Friends');

SELECT * FROM address_books;
+------------------+------------+
| addressbook_name | type       |
+------------------+------------+
| book1            | Family     |
| book2            | Profession |
| book3            | Friends    |
+------------------+------------+
3 rows in set (0.0006 sec)


CREATE TABLE contact(
person_id          INT NOT NULL,
addressbook_name   VARCHAR(200) REFERENCES addressbook_main(addressbook_name),
first_name         VARCHAR(200) NOT NULL,
last_name          VARCHAR(200) NOT NULL,
PRIMARY KEY        (person_id)
);

INSERT INTO contact VALUES
(1,'book1','aakash','gandhi'),
(2,'book1','ankur','kaur'),
(3,'book2','rani','jaju'),
(4,'book2','chandan','malhotra'),
(5,'book3','sagar','pandit'),
(6,'book3','endsa','trapira');

SELECT * FROM contact;
+-----------+------------------+------------+-----------+
| person_id | addressbook_name | first_name | last_name |
+-----------+------------------+------------+-----------+
|         1 | book1            | aakash     | gandhi    |
|         2 | book1            | ankur      | kaur      |
|         3 | book2            | rani       | jaju      |
|         4 | book2            | chandan    | malhotra  |
|         5 | book3            | sagar      | pandit    |
|         6 | book3            | endsa      | trapira   |
+-----------+------------------+------------+-----------+
6 rows in set (0.0006 sec)

CREATE TABLE contact_details(
person_id           INT REFERENCES  address_book(person_id),
phone_number        VARCHAR(200) NOT NULL,
email               VARCHAR(200) NOT NULL
);

INSERT INTO contact_details VALUES      
(1,'987654321','aakash@gmail.com'),
(2,'23456789','ankur@gmail.com'),
(3,'787865432','rani@gmail.com'),
(4,'98765678','chandan@gmail.com'),
(5,'880054322','sagar@gmail.com'),
(6,'71206080','endsa@gmail.com'),
(6,'90677645','trapira@gmail.com');

SELECT * FROM contact_details;
+-----------+--------------+-------------------+
| person_id | phone_number | email             |
+-----------+--------------+-------------------+
|         1 | 987654321    | aakash@gmail.com  |
|         2 | 23456789     | ankur@gmail.com   |
|         3 | 787865432    | rani@gmail.com    |
|         4 | 98765678     | chandan@gmail.com |
|         5 | 880054322    | sagar@gmail.com   |
|         6 | 71206080     | endsa@gmail.com   |
|         6 | 90677645     | trapira@gmail.com |
+-----------+--------------+-------------------+
7 rows in set (0.0007 sec)


CREATE TABLE address(
person_id    INT REFERENCES address_book(person_id),
street       VARCHAR(200) NOT NULL,
city  VARCHAR(200) NOT NULL,
state  VARCHAR(200) NOT NULL,
zip  INT NOT NULL); 

INSERT INTO address VALUES
(1,'mt','panipat','haryana','132103'),
(2,'sn','delhi','delhi','987621'),
(3,'tripolia','jodhpur','rajasthan','621345'),
(4,'alpha 1','greater noida','up','123102'),
(5,'sector 21','gurugram','haryana','8765432'),
(6,'dwarka','delhi','delhi','621322');  

SELECT * FROM address;
+-----------+-----------+---------------+-----------+---------+
| person_id | street    | city          | state     | zip     |
+-----------+-----------+---------------+-----------+---------+
|         1 | mt        | panipat       | haryana   |  132103 |
|         2 | sn        | delhi         | delhi     |  987621 |
|         3 | tripolia  | jodhpur       | rajasthan |  621345 |
|         4 | alpha 1   | greater noida | up        |  123102 |
|         5 | sector 21 | gurugram      | haryana   | 8765432 |
|         6 | dwarka    | delhi         | delhi     |  621322 |
+-----------+-----------+---------------+-----------+---------+
6 rows in set (0.0006 sec)



uc12:

SELECT * FROM contact WHERE person_id IN(SELECT person_id FROM address WHERE city = 'gurugram');
+-----------+------------------+------------+-----------+
| person_id | addressbook_name | first_name | last_name |
+-----------+------------------+------------+-----------+
|         5 | book3            | sagar      | pandit    |
+-----------+------------------+------------+-----------+
1 row in set (0.0399 sec)


SELECT * FROM contact WHERE person_id IN(SELECT person_id FROM address WHERE state = 'haryana');
+-----------+------------------+------------+-----------+
| person_id | addressbook_name | first_name | last_name |
+-----------+------------------+------------+-----------+
|         1 | book1            | aakash     | gandhi    |
|         5 | book3            | sagar      | pandit    |
+-----------+------------------+------------+-----------+
2 rows in set (0.0007 sec)

SELECT COUNT(person_id) FROM contact WHERE person_id IN(SELECT person_id FROM address WHERE city ='delhi');
+------------------+
| COUNT(person_id) |
+------------------+
|                2 |
+------------------+
1 row in set (0.0006 sec)


SELECT COUNT(person_id) FROM contact WHERE person_id IN(SELECT person_id FROM address WHERE state ='haryana');
+------------------+
| COUNT(person_id) |
+------------------+
|                2 |
+------------------+
1 row in set (0.0008 sec)
